{
  "identity": {
    "id": "github:acme/widget:issue:42",
    "source_native_id": "acme/widget#42"
  },
  "source": {
    "system": "github",
    "org": "acme",
    "actor": "octocat"
  },
  "time": {
    "occurred_at": "2026-09-23T22:15:00Z",
    "ingested_at": "2026-09-23T22:15:04Z"
  },
  "content_refs": [
    {
      "kind": "url",
      "ref": "https://github.com/acme/widget/issues/42"
    }
  ],
  "raw_ref": {
    "kind": "object",
    "ref": "s3://ember-raw/github/acme/widget/issues/42.json"
  },
  "type": "issue.opened",
  "metadata": {
    "delivery": "webhook"
  },
  "payload": {
    "repository": "acme/widget",
    "number": 42,
    "title": "Login redirect drops the query string"
  }
}
